{
  "$schema": "https://json-schema.org/draft/2020-12/schema",
  "$id": "https://github.com/zhanghao1903/macos-computer-use/blob/main/plugins/codex-claude-engineering-lifecycle/schemas/release-authorization.schema.json",
  "title": "ReleaseAuthorization",
  "type": "object",
  "additionalProperties": false,
  "required": ["schemaVersion", "workflowId", "featureId", "mergeCommitSha", "version", "tag", "targets", "authorizedBy", "authorizationEvidence", "createdAt"],
  "properties": {
    "schemaVersion": {"const": 1},
    "workflowId": {"type": "string", "format": "uuid"},
    "featureId": {"$ref": "#/$defs/featureId"},
    "mergeCommitSha": {"$ref": "#/$defs/sha"},
    "version": {"$ref": "#/$defs/semver"},
    "tag": {"type": "string", "minLength": 1, "maxLength": 200},
    "targets": {
      "type": "array",
      "minItems": 1,
      "maxItems": 20,
      "items": {"$ref": "#/$defs/target"}
    },
    "authorizedBy": {"type": "string", "minLength": 1, "maxLength": 200},
    "authorizationEvidence": {"type": "string", "minLength": 1, "maxLength": 500},
    "createdAt": {"$ref": "#/$defs/timestamp"},
    "authorizationId": {"$ref": "#/$defs/digest"}
  },
  "$defs": {
    "digest": {"type": "string", "pattern": "^[0-9a-f]{64}$"},
    "sha": {"type": "string", "pattern": "^[0-9a-f]{40}$"},
    "featureId": {"type": "string", "pattern": "^[a-z0-9](?:[a-z0-9-]{0,62}[a-z0-9])?-[0-9a-f]{12}$", "maxLength": 76},
    "timestamp": {"type": "string", "format": "date-time", "pattern": "^\\d{4}-\\d{2}-\\d{2}T\\d{2}:\\d{2}:\\d{2}Z$"},
    "semver": {"type": "string", "pattern": "^(0|[1-9][0-9]*)\\.(0|[1-9][0-9]*)\\.(0|[1-9][0-9]*)(?:-[0-9A-Za-z-]+(?:\\.[0-9A-Za-z-]+)*)?(?:\\+[0-9A-Za-z-]+(?:\\.[0-9A-Za-z-]+)*)?$", "maxLength": 100},
    "artifact": {
      "type": "object",
      "additionalProperties": false,
      "required": ["name", "sha256"],
      "properties": {
        "name": {"type": "string", "pattern": "^[A-Za-z0-9][A-Za-z0-9._+-]{0,199}$"},
        "sha256": {"$ref": "#/$defs/digest"}
      }
    },
    "target": {
      "oneOf": [
        {
          "type": "object",
          "additionalProperties": false,
          "required": ["kind", "repositoryKey", "tag", "releaseName", "artifacts"],
          "properties": {
            "targetId": {"$ref": "#/$defs/digest"},
            "kind": {"const": "GITHUB_RELEASE"},
            "repositoryKey": {"type": "string", "pattern": "^[A-Za-z0-9_.-]+/[A-Za-z0-9_.-]+$", "maxLength": 300},
            "tag": {"type": "string", "minLength": 1, "maxLength": 200},
            "releaseName": {"type": "string", "minLength": 1, "maxLength": 200},
            "artifacts": {"type": "array", "minItems": 1, "maxItems": 100, "items": {"$ref": "#/$defs/artifact"}}
          }
        },
        {
          "type": "object",
          "additionalProperties": false,
          "required": ["kind", "repository", "projectName", "version", "artifacts"],
          "properties": {
            "targetId": {"$ref": "#/$defs/digest"},
            "kind": {"const": "PYPI"},
            "repository": {"enum": ["PYPI", "TEST_PYPI"]},
            "projectName": {"type": "string", "minLength": 1, "maxLength": 200},
            "version": {"$ref": "#/$defs/semver"},
            "artifacts": {"type": "array", "minItems": 1, "maxItems": 100, "items": {"$ref": "#/$defs/artifact"}}
          }
        }
      ]
    }
  }
}
